{
  "vendor": "LiquidSonics",
  "homepage": "https://www.liquidsonics.com/",
  "trustedDomain": "liquidsonics.com",
  "plugins": [
    {
      "bundleId": "com.liquidsonics.cinematic-rooms",
      "name": "Cinematic Rooms",
      "latestVersion": "1.3.9",
      "vendorPage": "https://www.liquidsonics.com/software/cinematic-rooms/",
      "notes": null
    },
    {
      "bundleId": "com.liquidsonics.cinematic-rooms.professional",
      "name": "Cinematic Rooms Professional",
      "latestVersion": "1.3.9",
      "vendorPage": "https://www.liquidsonics.com/software/cinematic-rooms/",
      "notes": null
    },
    {
      "bundleId": "com.liquidsonics.HDCart",
      "name": "HD Cart",
      "latestVersion": "1.3.8",
      "vendorPage": "https://www.liquidsonics.com/software/hd-cart/",
      "notes": null
    },
    {
      "bundleId": "com.liquidsonics.Illusion",
      "name": "Illusion",
      "latestVersion": "1.4.6",
      "vendorPage": "https://www.liquidsonics.com/software/illusion/",
      "notes": null
    },
    {
      "bundleId": "com.liquidsonics.LustrousPlates",
      "name": "Lustrous Plates",
      "latestVersion": "1.3.7",
      "vendorPage": "https://www.liquidsonics.com/software/lustrous-plates/",
      "notes": null
    },
    {
      "bundleId": "com.liquidsonics.LustrousPlatesSurround",
      "name": "Lustrous Plates Surround",
      "latestVersion": "1.3.7",
      "vendorPage": "https://www.liquidsonics.com/software/lustrous-plates-surround/",
      "notes": null
    },
    {
      "bundleId": "com.liquidsonics.M7Link",
      "name": "M7 Link",
      "latestVersion": "1.2.8",
      "vendorPage": "https://www.liquidsonics.com/software/m7-link/",
      "notes": null
    },
    {
      "bundleId": "com.liquidsonics.Reverberate3",
      "name": "Reverberate 3",
      "latestVersion": "3.4.6",
      "vendorPage": "https://www.liquidsonics.com/software/reverberate-3/",
      "notes": null
    },
    {
      "bundleId": "com.liquidsonics.SeventhHeaven",
      "name": "Seventh Heaven",
      "latestVersion": "1.5.8",
      "vendorPage": "https://www.liquidsonics.com/software/seventh-heaven/",
      "notes": null
    },
    {
      "bundleId": "com.liquidsonics.SeventhHeaven_Professional",
      "name": "Seventh Heaven Professional",
      "latestVersion": "1.5.8",
      "vendorPage": "https://www.liquidsonics.com/software/seventh-heaven-professional/",
      "notes": null
    },
    {
      "bundleId": "com.liquidsonics.TaiChi",
      "name": "Tai Chi",
      "latestVersion": "1.6.2",
      "vendorPage": "https://www.liquidsonics.com/software/tai-chi/",
      "notes": null
    },
    {
      "bundleId": "com.liquidsonics.TaiChiLite",
      "name": "Tai Chi Lite",
      "latestVersion": "1.6.2",
      "vendorPage": "https://www.liquidsonics.com/software/tai-chi/",
      "notes": null
    }
  ]
}
